{ "template_id": "typed-brief", "version": "2", "kind": "typed/implement", "before": "", "after": "Name the file you will change before you change it.", "source": "hand", "role": "retired", "created_at": "2026-10-12T08:00:00.0000000Z", "decisions": [ { "decided_at": "2026-10-12T08:00:00.0000000Z", "action": "add" }, { "decided_at": "2026-10-19T09:00:00.0000000Z", "action": "retire", "counts": "{\"challenger_runs\":60}", "note": "no better after 60 runs" } ] }
